2153,Andrelon,Gezond & verzorging,,"Deze shampoo helpt je droge, beschadigde haar actief te herstellen. De unieke formule met NutriKeratine zorgt ervoor dat je haar van binnen en buiten wordt versterkt en hersteld. Het resultaat is sterk, glanzend haar dat heerlijk aanvoelt en er gezond uitziet.",Vrouw,Andrélon Shampoo Care & Repair 300 ml,229,,Haarverzorging,Shampoo,,0,3 voor 6,Vrouwen,ml,,Care & repair,,,,,,
2583,Andrelon,Gezond & verzorging,,"2 in 1 is een verzorgende shampoo en conditioner ineen. Het biedt de juiste combinatie tussen een frisse reiniging en een mild voedende verzorging. Met 2 in 1 is je haar gezond, glanzend en makkelijk doorkambaar. Je haar is weer helemaal fris.&nbsp;",Vrouw,Andrélon Shampoo 2 In 1 300 ml,229,,Haarverzorging,Shampoo,,60,3 voor 6,Vrouwen,ml,,2 in 1,,,,,,
2539,Andrelon,Gezond & verzorging,,"Voor een intensieve verzorging van gekleurd haar gebruik je deze Shampoo. De rijke samenstelling, met UV filter, perzikextract en macadamia-olie, verzorgt en herstelt je haar en helpt zo de levendigheid en diepe glans van je kleur langdurig vast te houden.",Vrouw,Andrélon Levendige Kleur Shampoo 300 ml,229,,Haarverzorging,Shampoo,,38,3 voor 4,Vrouwen,ml,,Levendige Kleur,,,,,,
5844,Andrelon,Gezond & verzorging,,"Andrélon Langer Fris is speciaal ontwikkeld voor normaal haar dat snel vet wordt. De milde en zuivere shampoo, met citrusextract, zorgt ervoor dat je haar bij de wortel langer fris en schoon blijft. Je haar blijft luchtig, ruikt lekker fris en ziet er gezond uit.",Unisex,Andrélon Shampoo Langer Fris 300 ml,229,,Haarverzorging,Shampoo,,0,3 voor 6,Vrouwen,ml,,Langer fris,,,Citrus,,Thuis gebruik,
3837,Andrelon,Gezond & verzorging,,"Deze For men shampoo is een frisse, milde shampoo om dagelijks je haar mee te wassen. Zeer frisse en milde samenstelling voor dagelijks gebruik. Houd je haar in conditie. Om snel en effectief het haar te wassen, zonder te veel gedoe. Deze shampoo is geschikt voor ieder haartype.&nbsp;",Man,Andrélon Shampoo For Men Iedere Dag 300 ml,229,,Haarverzorging,Shampoo,,31,3 voor 6,Mannen,ml,,Andrélon Men,,,,,,
2540,Andrelon,Gezond & verzorging,,"Deze shampoo houdt je haar dagelijks in conditie en is zeer mild, verzorgend en reinigend.• Is pH neutraal en geschikt voor ieder haartype• Bevat voedingsrijk zonnebloemextract&nbsp;• Voor heerlijk luchtig en fris haar, vol glansDe shampoo is een zeer milde, verzorgende en reinigende shampoo met zonnebloemextract. Het houdt je haar dagelijks in conditie, vol van glans en vitaliteit. De shampoo is pH neutraal en respecteert de hoofdhuid en het haar. Speciaal voor haar dat iedere dag gewassen wordt zijn er de Iedere Dag producten. De producten zijn mild en geschikt voor ieder haartype. Het resultaat is heerlijk luchtig en fris haar vol met glans. Gebruik voor een optimaal verzorging voor je haar ook de Andrélon Iedere Dag conditioner.&nbsp;",Vrouw,Andrélon Shampoo Iedere Dag 300 ml,229,,Haarverzorging,Shampoo,,62,3 voor 6,Vrouwen,ml,,Iedere dag,,,,,,
2543,Andrelon,Gezond & verzorging,,"De Hair &amp; Body shampoo is speciaal ontwikkeld om zowel je haar als je lichaam mee te wassen. Het biedt niet alleen een milde reiniging voor je haar, maar bevat ook hydraterende bestanddelen voor je huid. Met de perfecte verzorging in één fles ben je lekker snel klaar. De For Men haarverzorgingsproducten zijn speciaal ontwikkeld voor mannen zodat ze snel en effectief hun haar kunnen wassen, zonder te veel gedoe. &nbsp; &nbsp;",Man,Andrélon Shampoo For Men Hair & Body 300 ml,229,,Haarverzorging,Shampoo,,65,3 voor 6,Mannen,ml,,Andrélon Men,,,2 in 1,,,
2536,Andrelon,Gezond & verzorging,,"Deze lijn is speciaal ontwikkeld voor de intensieve verzorging van krullend haar. De shampoo, verrijkt met verzorgende oliën, accentueert de kracht van je krullen. Met Andrélon Perfecte Krul worden je krullen weer makkelijk handelbaar en voelen ze zacht, flexibel en veerkrachtig aan. Het resultaat is een perfecte bos krullen.&nbsp;Gebruik voor een optimaal resultaat ook de andere producten uit de Andrélon Perfecte Krul lijn. &nbsp;",Vrouw,Andrélon Shampoo Perfecte Krul 300 ml,229,,Haarverzorging,Shampoo,,0,3 voor 6,Vrouwen,ml,,Perfecte krul,,,,,,
7105,Andrelon,Gezond & verzorging,,"Deze intensieve shampoo, met repair serum en unieke Hair Protect formule, geeft je haar een diepe, intensieve verzorging. De rijke formule geeft na het wassen extra kracht en voeding aan je haar en helpt gespleten haarpunten te voorkomen.",Vrouw,Andrélon Perfecte Puntjes Shampoo 300 ml,229,,Haarverzorging,Shampoo,,54,3 voor 6,Vrouwen,ml,,Perfecte puntjes,,,Perfecte puntjes,,Thuis gebruik,
2547,Andrelon,Gezond & verzorging,,Deze shampoo verzorgt en voedt fijn en steil haar zonder het te verzwaren. Pluizig en statisch haar wordt tegengegaan terwijl de luchtigheid in je haar behouden blijft. Het resultaat is prachtig steil haar dat er vol en gezond uitziet.,Vrouw,Andrélon Steilvol Shampoo 300 ml,229,,Haarverzorging,Shampoo,,28,3 voor 6,Vrouwen,ml,,Steil Vol,,,,,,
2542,Andrelon,Gezond & verzorging,,"De krachtige formulering met bamboe geeft je haar dagelijkse verzorging en bescherming die het nodig heeft om te herstellen zonder het zwaar te maken. Je haar voelt weer gezond, luchtig en veerkrachtig aan.",Unisex,Andrélon Veerkracht Shampoo 300 ml,229,,Haarverzorging,Shampoo,,0,3 voor 6,Volwassenen,ml,,Veerkracht,,,Bamboe,,,
2549,Andrelon,Gezond & verzorging,,"Deze lijn is speciaal ontwikkeld voor de verzorging van blond haar. De shampoo is verrijkt met kamille, dat bekend staat om haar verhelderende eigenschappen, en honing. Met Andrélon Zomer Blond wordt je blonde haar heerlijk verzorgd en krijgt het een natuurlijke, zomerse glans. Het hele jaar door het effect van de zon in je haar!",Vrouw,Andrélon Shampoo Zomerblond 300 ml,229,,Haarverzorging,Shampoo,,0,3 voor 6,Vrouwen,ml,,Zomer Blond,,,,,,
2555,Andrelon,Gezond & verzorging,,"Om futloos haar meer volume te geven gebruik je de Verrassend Volume shampoo. Met lift-up system en verrijkt met collageen. Maakt elke afzonderlijke haar dikker en zorgt zo dat het voller aanvoelt. Geeft je haar niet alleen meer volume, het voelt ook voller en dikker aan. &nbsp;&nbsp;",Vrouw,Andrélon Shampoo Verrassend Volume 300 ml,229,,Haarverzorging,Shampoo,,0,3 voor 6,Vrouwen,ml,,Verrassend Volume,,,,,,
26197,Andrelon,Gezond & verzorging,,Ervaar de vrijheid die de Restyle Gum van Andrélon Men Stylegeeft. De Restyle Gum is ideaal om elke style te creëren en geeft langdurige fixatie. De sterkte van de Restyle Gum is 5 en is geschikt om normaal tot dik haar in model te brengen.,Man,Andrélon Men Style Restyle Gum 75 ml,399,,Haarverzorging,Haarstyling,,0,3 voor 10,Mannen,ml,,Andrélon Men,,,Restyle Gum,,,
4030,Andrelon,Gezond & verzorging,,De Verrassend Volume haarspray geeft je haar een boost van volume vanaf de haaraanzet voor een volle en frisse uitstraling. De spray biedt een langdurig fixatie en is gemakkelijk uit te borstelen. De spray heeft een fijne verstuiving en droogt snel.&nbsp;,Vrouw,Andrélon Hairspray Verrassend Volume 250 ml,399,,Haarverzorging,Haarstyling,,13,3 voor 10,Vrouwen,ml,,Verrassend Volume,,,Verrassend Volume,,,
23422,Andrelon,Gezond & verzorging,,"Deze spray accentueert je krullen en brengt de krullen terug in je haar zonder het haar hard of plakkerig te maken. Ideaal om ‘s ochtends of ‘s middags je krullen mee tot leven te brengen. Speciaal voor krullend haar is de Perfecte Krul haarverzorgings- en stylingslijn ontwikkeld. De producten geven je krullen langdurige veerkracht en gaan pluizen tegen. Ze brengen je krullen terug in je haar en accentueren je krullen zonder het haar hard te maken. Het resultaat is een perfecte bos, handelbare krullen.• Deze spray accentueert je krullen en brengt de krullen terug in je haar.• Geeft je krullen langdurige veerkracht en gaat pluizen tegen.• Ideaal om ‘s ochtends of ‘s middags je krullen mee tot leven te brengen.• Accentueert je krullen zonder het haar hard of plakkerig te maken.De spray gelijkmatig over je vochtige of droge krullen verdelen. Knijp je krullen vervolgens weer mooi in model.",Vrouw,Andrélon Hairspray Perfecte Krul Booster 150 ml,399,,Haarverzorging,Haarstyling,,0,3 voor 10,Vrouwen,ml,,Hairspray,,,Perfecte Krul Booster,,spray,
33555,Apollo,Kleding & sieraden,,Vijf paar dames sokken voor in sneaker.,Vrouw,Apollo Ladies Sneaker sokken 36-41 5 Pack,299,,Dames,Panties en sokken,,0,3 voor 8,Vrouwen,st,,,,,,,,
32785,Aquafresh,Gezond & verzorging,,"Aquafresh mondwater is een lekker smakende, alcoholvrije mondwater dat geschikt is voor de hele familie. Het is niet alleen fris, maar bevat ook versterkende mineralen die tussen de tanden gaan om deze gebieden te beschermen.&nbsp;",Unisex,Aquafresh Tingling Mint Mondwater 500 ml,299,,Mondverzorging,Mondwater & spray,,0,3 voor 8,Volwassenen,ml,,,,,Tingling Mint,,,
32846,Aquafresh,Gezond & verzorging,,"Last van beschadigd tandvlees en tandvleeshalzen? Gebruik dan de Flex Protect tandenborstel van Aquafresh. Dankzij de flexibele zone in de tandenborstel steel, helpt deze tandenborstel beschadigingen van tandvlees en tandvleeshalsen te voorkomen.",Unisex,Aquafresh Flex Protect Tandenborstel Hard,179,,Mondverzorging,Tandenborstels,,0,3 voor 5,Volwassenen,st,,,,Hard,,,,
31857,Aquafresh,Gezond & verzorging,,"Last van beschadigd tandvlees en tandvleeshalzen? Gebruik dan de Flex Protect tandenborstel van Aquafresh. Dankzij de flexibele zone in de tandenborstel steel, helpt deze tandenborstel beschadigingen van tandvlees en tandvleeshalsen te voorkomen.",Unisex,Aquafresh Flex Protect Tandenborstel Medium,179,,Mondverzorging,Tandenborstels,,0,3 voor 5,Volwassenen,st,,,,Medium,,,,
32845,Aquafresh,Gezond & verzorging,,Bereik 50% dieper tussen je tanden met de Aquafresh Inter Espaces Flextandenborstel. De borstelharen van deze tandenborstel zijn geïnspireerd door flosdraad. Dagelijks flossen wordt nog wel steeds aanbevolen.,Unisex,Aquafresh Inter Espaces Flex Tandenborstel Medium,229,,Mondverzorging,Tandenborstels,,0,3 voor 6,Volwassenen,st,,,,Medium,,,,
32947,Aquafresh,Gezond & verzorging,,Aquafresh Freshmint is een tandpasta die geschikt is voor heel de familie. De Aquafresh drievoudige bescherming is nu nog beter. De nieuwe glazuur+ formule versterkt de tanden. Het helpt vitale mineralen in te sluiten en te beschermen tegen zuuraanvallen.,Unisex,Aquafresh Fresh & Minty Tandpasta 100 ml,129,,Mondverzorging,Tandpasta,,0,3 voor 3,Volwassenen,ml,,,,,Fresh & Minty,,,
31852,Aquafresh,Gezond & verzorging,,Bescherm je tanden tegen plaque en bacteriën met de Triple Protection tandenborstel van Aquafresh! Dankzij de vorm van de borstelhaartjes kom je 25% beter bij moeilijke plekjes.,Unisex,Aquafresh Triple Protection Tandenborstel Medium,179,,Mondverzorging,Tandenborstels,,0,3 voor 5,Volwassenen,st,,,,Medium,,,,
32944,Aquafresh,Gezond & verzorging,,"Zoals je gewend bent biedt Aquafresh een drievoudige bescherming. De drievoudige bescherming bestaat uit het verminderen van tandplak, het bevatten van fluoride voor actieve bescherming tegen gaatjes en het geven van een frisse adem.",Unisex,Aquafresh Mild & Minty Tandpasta 100 ml,129,,Mondverzorging,Tandpasta,,0,3 voor 3,Volwassenen,ml,,,,,Mild & Minty,,,
21762,Aquafresh,Gezond & verzorging,,"Aquafresh Tandpasta voor heel de familie. Aquafresh drievoudige becherming is een tandpasta met een actief mineraal, fluoride, die bindt aan het tandglazuur en helpt je tandglazuur te versterken. Aquafresh drievoudige bescherming biedt alles wat je wilt van een tandpasta.",Unisex,Aquafresh Whitening Pomp Tandpasta 100 ml,199,,Mondverzorging,Tandpasta,,0,"3 voor 5,50",Volwassenen,ml,,,,,Whitening,,,
21763,Aquafresh,Gezond & verzorging,,"Aquafresh Tandpasta Pomp voor heel de familie. Aquafresh drievoudige bescherming is een tandpasta met een actief mineraal, fluoride, die bindt aan het tandglazuur en helpt je tandglazuur te versterken. Aquafresh drievoudige bescherming biedt alles wat je wilt van een tandpasta.",Unisex,Aquafresh Tandpasta Fresh & Minty 100 ml,199,,Mondverzorging,Tandpasta,,0,"3 voor 5,50",Volwassenen,ml,,,,,Fresh & Minty,,,
32836,Aquafresh,Gezond & verzorging,,"De Aquafresh White &amp; Shine zorgt ervoor dat je tanden langer stralend wit blijven. Ontwikkeld voor dagelijks gebruik. Voel het verschil na één keer poetsen.Deze tandpasta bevat kleine micorkorreltjes die je tanden zachtjes glad en schoon poetsen, zodat ze stralen. Daarnaast legt het een beschermend laagje over je tanden die het terugkeren van kleuroneffenheden en kleurvlekjes tegengaat.",Unisex,Aquafresh White & Shine Tandpasta 100 ml,179,,Mondverzorging,Tandpasta,,0,3 voor 5,Volwassenen,ml,,,,,White & Shine,,,
32842,Aquafresh,Gezond & verzorging,,"Deze tandpasta van Aquafresh beschermt je gebit tegen gaatjes, bestrijdt tandplak, zorgt voor gezond tandvlees, maakt je tandglazuur sterker, geeft je een frisse adem, verwijdert vlekken, is antibacterieel en heeft een geweldige smaak.&nbsp;Veel voordelen in één tandpasta voor het hele gezin. Aquafresh Complete Care tandpasta is verrijkt met actieve mineralen (fluoride en zink), versterkt je tandglazuur en biedt Suikerzuur Bescherming plus een antibacteriële werking.Bacteriën in tandplak kunnen suiker omzetten in zuren die gaatjes veroorzaken. Fluoride wordt opgenomen door de tanden en helpt ze te versterken vormt een beschermende laag en helpt zo de tanden tegen suikerzuuraanvallen beschermen.",Kinderen,Aquafresh Complete Care Original 75 ml,179,,Mondverzorging,Tandpasta,,0,3 voor 5,Kinderen,ml,,,,,Complete Care,,,
32840,Aquafresh,Gezond & verzorging,,"De Complete Care tandpasta is verrijkt met actieve mineralen (fluoride en zink), versterkt je tandglazuur en biedt Suikerzuur Bescherming plus een antibacteriële werking. Deze tandpasta heeft een frisse muntsmaak en heeft een mild whitening effect.",Unisex,Aquafresh Complete Care Whitening Tandpasta 75 ml,179,,Mondverzorging,Tandpasta,,0,3 voor 5,Volwassenen,ml,,,,,Whitening,,,
33587,Aquafresh,Gezond & verzorging,,Aquafresh Frisse Munt is een tandpasta die geschikt is voor heel de familie. De Aquafresh drievoudige bescherming is nu nog beter. De nieuwe glazuur+ formule versterkt de tanden. Het helpt vitale mineralen in te sluiten en te beschermen tegen zuuraanvallen.,Unisex,Aquafresh Frisse Munt Tandpasta 75 ml,129,,Mondverzorging,Tandpasta,,0,3 voor 3,Volwassenen,ml,,,,,Frisse Munt,,,
22234,Argan,Gezond & verzorging,,"Last van droog en beschadigd haar? Gebruik dan Argan Oli conditioner om je haar te voeden en te beschermen tegen externe invloeden. Het helpt om dof en pluizig haar elasticiteit en glans te geven, zonder dat het haar er vettig van wordt. Je zult merken dat droog en beschadigd haar er weer gezond uit gaat zien.&nbsp;",Vrouw,Argan Oil Conditioner 150ml + 100ml gratis,229,,Haarverzorging,Conditioner,,24,3 voor 6,Vrouwen,ml,,,,,,,,
22235,Argan,Gezond & verzorging,,"Last van droog en beschadigd haar? Gebruik dan Argan Oli haarmasker om je haar te voeden en te beschermen tegen externe invloeden. Het helpt om dof en pluizig haar elasticiteit en glans te geven, zonder dat het haar er vettig van wordt. Je zult merken dat droog en beschadigd haar er weer gezond uit gaat zien.&nbsp;",Vrouw,Argan Oil Intens Hydrate Hair Treatment 100ml,399,,Haarverzorging,Haarkuur en haarmasker,,23,3 voor 10,Vrouwen,ml,,,,,,,,
26306,Aquafresh,Gezond & verzorging,,"Aquafresh Freshmint geeft fluoride af aan je tandglazuur en helpt daardoor je tanden van binnenuit te versterken. De 3-voudige bescherming versterkt het tandglazuur, helpt zuuraanvallen van tandplak buiten te sluiten en helpt vitale mineralen in te sluiten.Hou je mond gezond en blij door er goed voor te zorgen met Aquafresh' unieke 3-voudige bescherming:Gezond tandvleesSterke tandenFrisse adem &nbsp;&nbsp;",Unisex,Aquafresh Freshmint 75 ml,129,,Mondverzorging,Tandpasta,,0,3 voor 3,Volwassenen,ml,,,,,Freshmint,,,
22233,Argan,Gezond & verzorging,,"Last van droog en beschadigd haar? Gebruik dan Argan Oli Shampoo om je haar te voeden en te beschermen tegen externe invloeden. Het helpt om dof en pluizig haar elasticiteit en glans te geven, zonder dat het haar er vettig van wordt. Je zult merken dat droog en beschadigd haar er weer gezond uit gaat zien.&nbsp;",Vrouw,Argan Oil Shampoo 150ml + 100ml gratis,229,,Haarverzorging,Shampoo,,14,3 voor 6,Vrouwen,ml,,,,,Multipack,,Thuis gebruik,
30791,At Home,Huishouden,,Geen nare luchtjes met deze luchtverfrisser van At Home. Een heerlijke Flower Power Geur. 100% ge&iuml;nspireerd op de natuur. Deze navulling is geschikt voor de At Home Verstuiver (incl. batterijen).,Unisex,At Home Automatic Navulling Luchtverfrisser Flower Power 250ml,149,,Toilet en keuken,Luchtverfrissers,,33,3 voor 4,Volwassenen,ml,,,,,,,,
21858,At Home,Huishouden,,Dit wasmiddel verwijdert hardnekkige vlekken en verfrist met de heerlijke geur van citroen.&nbsp;,Unisex,At home Ultra Citroen Afwasmiddel 500ml,59,,Wassen en schoonmaken,Afwasmiddel,,27,"3 voor 1,50",Volwassenen,ml,,,,,Citroen,,,
30790,At Home,Huishouden,,Geen nare luchtjes met deze luchtverfrisser van At Home. Een heerlijke geur van Magnolia. 100% ge&iuml;nspireerd op de natuur.&nbsp;Deze navulling is geschikt voor de&nbsp;At Home Verstuiver (incl. batterijen).,Vrouw,At Home Automatic Navulling Japanese Blossom 250 ml,149,,Toilet en keuken,Luchtverfrissers,,46,3 voor 4,Volwassenen,ml,,,,,,,,
30034,At Home,Huishouden,,Geen nare luchtjes met deze luchtverfrisser van At Home. Een heerlijke geur van Lavendel. 100% ge&iuml;nspireerd op de natuur en gaat tot wel 60 dagen mee.&nbsp;&nbsp;Deze navulling is geschikt voor de&nbsp;At Home Verstuiver (incl. batterijen).,Kinderen,At Home Automatic Lavender Navulling 250 ml,149,,Toilet en keuken,Toiletblokken,,0,3 voor 4,Kantoor,ml,,,,,Lavender,,,
